title,time,url,abstract
北京：朝阳东北部将新增40万平方米湿地,2018-04-22 10:07,http://www.xinhuanet.com/fortune/2018-04/22/c_1122721616.htm,通过山水乃园、何里栖地、黑桥公园等园林建设，串联乡域内河湖水系，朝阳东北部将新增水面和湿地共40万平方米，逐步实现“城在水中、水在绿中、绿在人中、人在画中”的美好景象
商周特写 | “Facebook会帮我找到好骗的傻瓜”,2018-04-22 10:03,http://www.sohu.com/a/229053625_320672,联属网络营销商推广的不乏合法企业，比如亚马逊(amazon.com inc.)和ebay，但同时，他们也是众多具有误导性的不正当广告背后的推手，这些广告污染了facebook、instagram、twitter和互联网的各个角落
谁是非州手机之王?不是苹果三星，也不是华为小米,2018-04-22 10:03,http://www.sohu.com/a/229053361_320672,在埃塞俄比亚的八年时间里，俞卫国帮助没有什么名气的传音控股(transsion holdings)成为了非洲领先的移动设备制造商，它是低调的中国品牌传音手机(tecno mobile)的持有者
商品房销售额涨幅远超面积增幅 房价上升压力不容忽视,2018-04-22 09:56,http://www.sohu.com/a/229051604_313745,“在很多一线、二线城市，由于新房受政策限制，价格上不去，出现了价格倒挂的情况，二手房的价格超过一手房，这样造成大批的人在购买一手房时出现哄抢的状态，”中国国际经济交流中心经济研究部研究员张焕波表示，“从供需关系上来看，房地产行业还是不容忽视，要防止泡沫化的风险，还要继续加大力度
17种高价肿瘤靶向药纳入上海医保范围，今年养老金继续增加,2018-04-22 09:55,http://www.sohu.com/a/229051077_260616,：17种高价肿瘤靶向药纳入上海医保范围，今年养老金继续增加
工信部：国产芯片对关键领域支撑能力显著增强,2018-04-22 09:54,http://www.xinhuanet.com/fortune/2018-04/22/c_1122721550.htm,国内生产线的建设有效带动了国产设备和材料等配套产业的发展，刻蚀机、离子注入等超过30种高端装备实现批量应用，靶材、电镀液等上百种关键材料均已成功验证，并形成销售
中科院微电子所所长：必须努力掌握核心技术,2018-04-22 09:52,http://www.xinhuanet.com/fortune/2018-04/22/c_1122721536.htm,叶甜春表示，信息技术是全球开放程度最高的产业之一，各个国家都是相互依存的，没有一个国家和企业能单独做完整个产业链上的一切事情，包括美国
“放管服”改革激活民间投资 构建新型政商关系,2018-04-22 09:47,http://www.xinhuanet.com/fortune/2018-04/22/c_1122721516.htm,近年来，我国出台了一系列举措，着力破解政商“亲”而不“清”、“清”而不“亲”等问题，着力营造依法保护企业家合法权益的法治环境、促进企业家公平竞争诚信经营的市场环境、尊重和激励企业家干事创业的社会氛围，加大知识产权保护，切实保护民间投资的合法权益
贵阳市“摇号及限行政策”进行重大调整,2018-04-22 09:43,http://www.xinhuanet.com/fortune/2018-04/22/c_1122721482.htm,根据贵阳市新修订的《贵阳市小客车号牌管理暂行规定》(2018年政府第58号令)，市公安交通管理局最新发布《关于调整贵阳市小客车号牌指标核发及通行管理规定的公告》，继2014年优化调整后，再次对贵阳市“摇号及限行政策”进行重大调整
国际舆论：美制裁中兴实为贸易保护 美企将蒙受巨额损失,2018-04-22 09:36,http://www.sohu.com/a/229050219_362042,中新社柏林4月21日电 针对美国商务部日前对中兴通讯发出激活拒绝令，禁止美国公司向中兴通讯出售元器件等产品的做法，美德英等国主要媒体指出，中兴为美国创造上万工作机会却遭美国“断供”零部件，美方最新举措的实质为施行贸易保护主义
中国加博会助推东莞加工贸易实现转型升级,2018-04-22 09:31,http://www.xinhuanet.com/fortune/2018-04/22/c_1122721399.htm,中国加工贸易产品博览会(简称“加博会”)执行秘书长、中共广东东莞市委常委、宣传部部长杨晓棠21日在第十届加博会成果发布会上表示，加博会已经在东莞连续举办了十届，规模越来越大，成效也越来越明显，功能也越来越突出，这一平台有效推动了东莞加工贸易转型升级
漩涡中的中兴：如何分享5G红利？,2018-04-22 09:23,http://www.sohu.com/a/229053275_561670,通过中兴通讯官网信息可以看到，在技术研发领域，尤其是业界比较关注的5g方面，中兴通讯近两年取得了不少突破：发布中国自主研发的首颗nb-iot安全物联网芯片、业界首款t级别5g承载旗舰平台、业界首款基于光波导技术的超大容量交叉平台、在美国日本发布折叠智能手机中兴天机axon m、成功通过中移5g承载spn原型设备实验室测试、推出的业界首个可商用的云原生carrier devops builder
中国加博会助推东莞加工贸易实现转型升级,2018-04-22 09:23,http://www.sohu.com/a/229049184_123753,中新网东莞4月22日电 (李映民 李获)中国加工贸易产品博览会(简称“加博会”)执行秘书长、中共广东东莞市委常委、宣传部部长杨晓棠21日在第十届加博会成果发布会上表示，加博会已经在东莞连续举办了十届，规模越来越大，成效也越来越明显，功能也越来越突出，这一平台有效推动了东莞加工贸易转型升级
兰州海关通关业务迎“关检一体化” 实现便民新通道,2018-04-22 09:17,http://www.xinhuanet.com/fortune/2018-04/22/c_1122721285.htm,各业务现场按照上述优化整合后的业务流程统一以海关名义对外开展工作，检验检疫原有管理要求、作业标准不变，实现“一口对外、一次办理”
雄安新区规划纲要：严禁大规模房地产开发,2018-04-22 09:17,http://www.sohu.com/a/229048854_135869,批复指出，雄安新区作为北京非首都功能疏解集中承载地，与北京城市副中心形成北京新的两翼，有利于有效缓解北京“大城市病”，探索人口经济密集地区优化开发新模式
国际化，中国期货业准备好了吗,2018-04-22 09:10,http://www.sohu.com/a/229050201_118392,”朱玉辰认为，中国期货市场国际化走两条路，一条路，比如原油期货，铁矿石期货，把境外投资者请进来
关于港股新政策后的种种疑问， 这里有一份来自港交所CEO李小加的答复,2018-04-22 09:02,http://www.sohu.com/a/229048201_114778,在此次大会的演讲之后，李小加也就投资人的一些主要疑问进行了解答
胡斐：短线三招锁盈利,2018-04-22 09:00,http://www.sohu.com/a/229050888_500856,具体就是在没什么征兆，前期成交量股价都很低迷的状态下，突然一举拉升2-3个涨停板，将股价推高到一个20%左右幅度的平台上，利用阴线，小阴线，或者长期横盘，让前面几个月甚至一年内“有些许盈利的，盈亏平衡的，被套解套出局的”这几种投资者手里的筹码，由于看到股价涨了20%-30%，又不涨了，担心“庄家”出货，就会在向下砸的阴线里卖出股票，从而庄家反而实现了获取大量筹码的机会
网购套路深！只怪自己太傻太天真 | 功夫TV,2018-04-22 09:00,http://www.sohu.com/a/229051141_500856,听到的人都忍不住想要打开手机里的淘宝（噢还有京东）
如松 ： 中美对抗的风暴中心在何处？,2018-04-22 09:00,http://www.sohu.com/a/229051140_500856,但当时索罗斯做空港币或许并不是一个战略性的好时机：第一，中国开始准备谈判加入世贸，加入世贸的中国进出口会快速壮大，这会带动香港的经济发展，去做空一个经济有向好预期的经济体的货币，事后看来无疑不是一个好的选择
投资的艺术：打击盗版仍在继续！,2018-04-22 09:00,http://www.sohu.com/a/229050963_500856,这个盗版在3月底被我们发现在网上非法销售“投资的艺术”，我们迅速行动，完成公证等准备工作，迅速通过公安机关调查，两个星期内，我们就已经将非法贩卖盗版者起诉到法庭，法庭已经正式立案
肖锋：美国制裁中兴正是国产芯片崛起的好机会，您想简单了！,2018-04-22 09:00,http://www.sohu.com/a/229050960_500856,：肖锋：美国制裁中兴正是国产芯片崛起的好机会，您想简单了
假老板微信指示转账76万元 财务被判赔公司15万元,2018-04-22 08:57,http://www.xinhuanet.com/fortune/2018-04/22/c_1122721100.htm,白云区法院审理认为，被告罗某作为原告公司负责审核及对外付款的财务人员，在没有相应审批手续且未核实的情况下，依据案外人通过微信发出的付款指令进行付款，从而造成原告损失，被告罗某具有过错，应承担相应的赔偿责任
美媒：美国打压中兴源于对中国科技崛起的恐慌！伤人者必自伤,2018-04-22 08:51,http://www.sohu.com/a/229048549_118392,一个很具体的担忧，就是他们（中兴和华为）在5g上的大规模投入，这可能会使得美国的无线运营商在未来只能依赖中国技术
动力电池企业业绩分化 上游材料企业却一片向好,2018-04-22 08:43,http://www.sohu.com/a/229046867_313745,同样受到动力电池及相关锂电需求的推动，锂电新能源核心材料供应商天齐锂业（002466.sz）在2017年创下业绩历史新高，实现营收54.7亿元、净利润21.5亿元，同比增幅均超过40%
食以“安”为先 2018中国(淮安)国际食品安全暨产业发展峰会召开,2018-04-22 08:41,http://www.sohu.com/a/229047005_114731,"12位嘉宾围绕当前食品生产、流通和消费领域的新业态、新模式、新技术、新趋势,各抒己见,共话国际食品安全治理与创新,共商食品产业振兴与发展"
人民日报:国内科技专家称我国高端芯片研制已具备基础,2018-04-22 08:38,http://www.xinhuanet.com/fortune/2018-04/22/c_1122720845.htm,“十三五”国家重点研发计划光电子与微电子器件及集成重点专项专家组组长、中科院半导体所副所长祝宁华表示，我国近年来不间断地支持光电子领域的科技创新，从“863”计划、“973”计划到国家自然科学基金等各类项目，都投入大量资金引导高校、科研院所和企业对光电子芯片和模块的关键技术进行了广泛而深入的研究，取得了丰硕的创新性成果
国家发改委专家：我国高技术产业将保持快速发展,2018-04-22 08:35,http://www.xinhuanet.com/fortune/2018-04/22/c_1122720823.htm,对此，国家发改委宏观经济研究院常务副院长王昌林表示，这将对我国高技术产业发展带来一定影响，但不会阻碍中国高技术产业快速发展步伐
北京动批疏解闭市 腾出空间将打造金融科技示范区,2018-04-22 08:30,http://www.xinhuanet.com/fortune/2018-04/22/c_1122720785.htm,老吴是动批的“大户”，在世纪天乐市场经营了近二十年，有两三层摊位，疏解后，他带着2000个商户前往白沟发展，前期，就将当地负责人带来指挥部座谈
2030年清洁空气市场将超20万亿，投资方向有新变化,2018-04-22 08:28,http://www.sohu.com/a/229046327_114986,在中关村创蓝清洁空气产业联盟日前召开的《2030清洁空气市场展望报告》发布会上，北京师范大学环境学院教授毛显强介绍，专家们预测，到2030年我国第三产业占比将超过60%，煤炭占总能耗比重低于42%，清洁能源占总能耗比例达22%，新能源汽车年销量或超1500万辆
人才不再偏爱北上广深，杭州、成都等新一线城市更获青睐,2018-04-22 08:28,http://www.sohu.com/a/229046404_114986,4月17日，移动招聘平台boss直聘发布《2018一季度人才吸引力报告》显示，根据报告，2017年下半年开始，以成都、武汉、南京、西安为代表的新一线城市集中推出人才吸引政策，多项政策形成全民热议
揭秘“月宫一号”内的生活：种菜养虫、上网追剧,2018-04-22 08:26,http://www.xinhuanet.com/fortune/2018-04/22/c_1122720758.htm,“月宫一号”目前在进行的“月宫365”实验，是针对载人月球基地及火星探测等航天计划而开展的综合性实验，主要任务是研究一个生物系统如何实现为不同代谢水平的乘员组提供生命保障，并保持系统稳定，为此8名志愿者需要交替分三个班次进入，封闭生活365天
浙江湖州市生态文明建设掠影：绿水青山变金山银山,2018-04-22 08:25,http://www.sohu.com/a/229045759_120702,10多年来，湖州以习近平总书记“绿水青山就是金山银山”理念为指引，依托良好的生态资源禀赋，把生态文明理念融入经济社会发展全过程，做精生态农业，做强生态工业，做优现代服务业，走出了一条生态经济化、经济生态化融合发展的新路
刷新世界纪录！中国深海水下滑翔机首潜8213米,2018-04-22 08:19,http://www.xinhuanet.com/fortune/2018-04/22/c_1122720714.htm,青岛海洋科学与技术国家实验室主任 吴立新：应该说这是我们国家在深海观测这个方面走出了历史性的一步，近万米的水下滑翔机的研制成功，会带动辐射我们国家整个在深海无人装备的发展，所以这是一个引领性的
工信部：中国制造业不会对外企设不公平障碍,2018-04-22 08:16,http://www.sohu.com/a/229045382_267106,苗圩表示，不仅不会设限制，中国制造业对外开放还需要进一步扩大开放领域，提高政策透明度和稳定性，优化政府服务效能，持续改善营商环境
北京迎来入春以来首场强降雨 缓解京城大部分地区旱情,2018-04-22 08:15,http://www.xinhuanet.com/fortune/2018-04/22/c_1122720699.htm,北京晨报讯针对本市出现的此次明显降雨，市交通委路政局迅速启动防汛保障指挥部应急联动机制， 对本市各道路加强了养护巡查，确保道路积水后能第一时间掌握积水情况，确保过往车辆安全
人才不再偏爱北上广深 杭州成都等新一线成跳槽首选,2018-04-22 08:12,http://finance.sina.com.cn/roll/2018-04-22/doc-ifznefkh5173581.shtml,4月17日，移动招聘平台boss直聘发布《2018一季度人才吸引力报告》显示，根据报告，2017年下半年开始，以成都、武汉、南京、西安为代表的新一线城市集中推出人才吸引政策，多项政策形成全民热议
首届数字中国建设成果展览会：“无人”时代来了,2018-04-22 08:11,http://www.xinhuanet.com/fortune/2018-04/22/c_1122720686.htm,金龙客车工程院副院长陈卫强谈及“阿波龙”时表示，目前跨国车企已部分实现l2级汽车的量产，以谷歌为代表的新技术力量在开展l4级研发测试，作为中国首款l4级无人驾驶巴士，“阿波龙”亦将于7月量产，“在‘无人’时代，中国不居于人后，更要先行一步”
芯片行业你应该知道的几个冷知识,2018-04-22 08:07,http://www.xinhuanet.com/fortune/2018-04/22/c_1122720602.htm,intel在几乎垄断了全球的电脑处理器市场，但是在移动端你却很难见到intel的身影，大多数主流手机厂商使用的都是高通公司的芯片
坐火车也要看日子！京沪动卧票价浮动价差最高达300元,2018-04-22 08:03,http://www.xinhuanet.com/fortune/2018-04/22/c_1122720613.htm,由此看来，京沪动卧票价的浮动基本遵循周一到周四、周六，平日价，周五、周日，周末价的价格规律
拉加德呼吁通过对话和多边机构解决贸易摩擦,2018-04-22 08:00,http://www.sohu.com/a/229071177_630337,当被新华社记者问及对解决中美贸易摩擦的建议时，拉加德说，希望中美两国尽可能多地开展以自由贸易为基础的对话，同时可借助以规则为基础的多边机构发挥作用
中美贸易战，中国“不惧”的底气来自哪儿？ | 每天听见吴晓波,2018-04-22 08:00,http://www.sohu.com/a/229045993_137204,而作为2001年中国加入wto的首席谈判代表，博鳌亚洲论坛的秘书长龙永图也指出：“特朗普没有看到全球贸易发展的整体态势，他用关税这样的老武器，表面上是惩罚中国，但最终受害的将是美国的产业界和消费者
中国加博会达成商贸合作项目逾8000宗 “吸金”超千亿,2018-04-22 07:57,http://www.xinhuanet.com/fortune/2018-04/22/c_1122720581.htm,加博会秘书长、广东省口岸办主任吴军在发布会上透露，今年加博会，秘书处通过各种途径拓宽加贸企业销售渠道，广邀重点商协会组织采购团，包括中国百货商业协会、中国超市联合采购联盟、中国商业联合会等27个国内重点商协会，以及欧美工商会、中国-东盟农资商会、巴基斯坦拉瓦尔品第工商联合会、马来西亚吉隆坡商会等境外采购团组
宋清辉：AH股价差有望进一步缩小。,2018-04-22 07:52,http://www.sohu.com/a/228943812_112589,近期，反映ah股价差的恒生ah股溢价指数持续走弱，今天（19日）报收于121.58点，下跌0.86%，创出10个月新低
宋清辉：新华网在全媒体发展上做更大文章,2018-04-22 07:52,http://www.sohu.com/a/228945828_112589,它依靠科技、资本、人才与传媒的深度融合，以及积极拓展ar/vr、无人机、大数据、物联网、人工智能等应用，成功打造了具有“新华网”特色的融媒体模式，抢占媒体融合新高地，并成为国内新闻网站综合排名首位、全球网站排名约前100位的新闻信息服务平台
粤港澳大湾区如何实现“世界级起飞”,2018-04-22 07:49,http://www.xinhuanet.com/fortune/2018-04/22/c_1122720548.htm,如果能把海外优秀的公司引到香港上市，这有利于推动香港的资本市场发展，进而为大湾区建设提供强有力的金融支持
对老年人销售保健品骗局又出新套路,2018-04-22 07:44,http://www.xinhuanet.com/fortune/2018-04/22/c_1122720518.htm,北青报记者了解，4月16日，一家名叫泰丰千年的公司，首先通过电话销售，然后专车接送，把近百名70岁以上的老人接到北京房山区长阳镇赵庄观光园，通过封闭培训，向他们介绍，销售“能够治愈各种癌症”的产品
桂林龙舟翻船 57人落水40人获救,2018-04-22 07:38,http://www.xinhuanet.com/fortune/2018-04/22/c_1122720507.htm,秀峰区政府相关负责人介绍，此次龙舟演练系敦睦村村民私自组织，此前曾报备但并未获通过，事发前一天还进行相关安全警示，结果发生意外
28年前10万元一辆，曾经称霸中国道路的国民轿车，停产了！,2018-04-22 07:37,http://www.sohu.com/a/229044320_115362,暂时性停产的背后是天津一汽夏利汽车股份有限公司窘迫的经营现状
北上广深靠边站，中国头号“堵城”，是它了！,2018-04-22 07:37,http://www.sohu.com/a/229044157_115362,晚高峰拥堵排行榜中，银川、汕头、洛阳位居前三，都是大、中型城市，老牌晚高峰堵城广州排名第六
为了排污机关算尽！公安出手，这家公司11人被采取强制措施,2018-04-22 07:37,http://www.sohu.com/a/229044159_115362,值得注意的是，督察组发现，辉丰股份下属子公司华通化学未经审批擅自变更生产工艺，将约2.2万吨化工残液通过罐车非法转移至无危险废物处置资质的盐城银天源制镁有限公司，再通过该公司雨水沟偷排外环境
获腾讯、京东、苏宁联手投资，新乐视智家能起死回生吗,2018-04-22 07:34,http://www.sohu.com/a/229025369_614005,而此次，生存艰难的乐视网能够吸引腾讯、京东、苏宁等大佬增资，一方面自然与孙宏斌个人强大的“朋友圈”有关，另一方面，最重要的还是因为对新乐视智家的一致看好
北京16区启动四风问题交叉巡察,2018-04-22 07:30,http://www.xinhuanet.com/fortune/2018-04/22/c_1122720494.htm,通州区区委巡察办相关负责人告诉北青报记者，通州区委高度重视此次“四风”问题专项巡察，对被巡察党组织实际状况不遮不掩，对顺义巡察组与通州区巡察组“一视同仁”，为巡察组了解实际情况、高效开展工作，提供最便利的条件
“放管服”改革激活民间投资,2018-04-22 07:22,http://www.sohu.com/a/229044790_118392,近年来，我国出台了一系列举措，着力破解政商“亲”而不“清”、“清”而不“亲”等问题，着力营造依法保护企业家合法权益的法治环境、促进企业家公平竞争诚信经营的市场环境、尊重和激励企业家干事创业的社会氛围，加大知识产权保护，切实保护民间投资的合法权益
美国财长努钦:正考虑前往中国谈判 解决贸易争端“谨慎乐观”,2018-04-22 07:19,http://www.sohu.com/a/229043074_119562,东方网4月22日消息：美国财长姆努钦周六表示，他正考虑去中国就贸易问题进行谈判，并对两国未来达成协议解决争端的可能性持“谨慎乐观”态度
大宗商品回调背后：利多仍扎堆，投资机遇集中爆发,2018-04-22 07:17,http://www.sohu.com/a/229045790_99992453,尽管4月19日、20日大宗商品普遍回调，但是近一段时间内大宗商品市场反弹势头强劲有目共睹，主要受到多重消息面及基本面因素的支撑，包括原油、铝等在内的商品价格都在近两周录得了大幅上涨
万得财经周刊：封杀中兴，特朗普舞剑，意在5G、半导体领域围堵中国,2018-04-22 07:17,http://www.sohu.com/a/229046158_99992453,据澎湃新闻，在美国提交的这份名为《关于某些中国进口商品的关税措施》文件中，美方称，已收到中方于4月4日就美国对华301调查项下征税建议在世贸组织争端解决机制下提起磋商请求，虽然中方信函中的美方拟征收关税措施还尚未实施，不符合wto相关争端解决机制相关条件，但美方仍愿就相关问题与中方进行磋商
财经趣谈：炒房的挖矿的圈钱的，你能整点芯片不？,2018-04-22 07:17,http://www.sohu.com/a/229046250_99992453,如果咱们充分利用资本市场为高科技输血，用高科技板块掀起一波牛市，有了赚钱效应，芯片领域这块相信也会有大额资金进入
巴曙松、王琳：资管行业的功能监管框架：国际经验与中国实践,2018-04-22 07:15,http://www.sohu.com/a/229044156_481741,虽然美国资产管理行业是多头功能监管模式，但其具有相同属性的“投资公司”接受美国证券交易委员会的统一监管，英国资产管理活动由金融行为监管局实施统一的行为监管，新加坡资产管理活动由金融监管局实施统一监管，监管内容普遍涵盖注册申请、投资范围、产品发行、信息披露、豁免情形等
“芯战争”升级！继中兴之后，美国又把枪口对准两家中国公司,2018-04-22 07:11,http://www.sohu.com/a/229043579_99985585,中兴与美国的数百家企业都有着高度合作，中兴手机在美国的市场份额超过10%，仅次于苹果、三星和lg，25-30%的零部件来自美国供应商，如果失去这一客户，高通等美国公司也不会好过，一刀切断中兴通讯与美国技术公司的关联，其实是“伤敌一千自损八百”的不明智做法
服务企业“走出去”――哈萨克斯坦税制概况,2018-04-22 07:00,http://www.sohu.com/a/229043935_391358,哈萨克斯坦现行的主要税种，包括企业所得税、个人所得税、增值税、消费税、社会税、土地税、运输工具税、财产税、法人不动产税，以及矿产开采税和其他税费
对北京共有产权房心动的，这条微信必看！,2018-04-22 07:00,http://www.sohu.com/a/229043710_391270,符合条件的家庭，可在共有产权住房项目开通网上申购期间内登陆区住房城乡建设委(房管局)官方网站提出项目购房申请，在线填写《家庭购房申请表》和《承诺书》，如实申报家庭人口、户籍、婚姻、住房等情况，并按照本办法规定的条件和项目公告，准备相关证明材料
马斯克又皮了，给超音速高铁装“秒停”刹车 乘客天天玩极限挑战,2018-04-22 07:00,http://www.sohu.com/a/229090747_375214,综合看来，马斯克的秒停超级高铁计划更像是一个永远也不能兑现的噱头，相较于联邦和议会、地方政府之间的扯皮，技术问题反而是最容易解决的，或许，马斯克真的只是想皮一下吧
福州与阿里巴巴合作打造智慧城市样本,2018-04-22 06:54,http://finance.sina.com.cn/stock/usstock/c/2018-04-22/doc-ifznefkh5014770.shtml,
土耳其作出重大决定 全球迎来黄金回流潮,2018-04-22 05:46,http://finance.sina.com.cn/stock/usstock/c/2018-04-22/doc-ifznefkh4913183.shtml,土耳其总统埃尔多安正对美国采取很强硬的态度，他本周指出全球贷款应当使用黄金而非美元
快消企业如何有效提升物流效率？,2018-04-22 04:53,http://www.sohu.com/a/229040786_563408,假设我们无论大家的角色是什么，有的可能是零售集团，有的可能是流通商，有的是制造商，有的可能是帮其他的这种公司做三方托管的整体的物流解决方案，但是无论怎么着，假如说我们仓库的位置是大差不差，也不是最好也不是最差，都应该是比较通常的情况，那么应该是有一个仓库在城市的郊区，那么前端无论是不是自己的门面，还是其他前面的收货方是客户，那么都会产生这一段的城配配送
