title,time,url,abstract
李迅雷：从人口迁徙看投资机会,2018-04-23 12:16,http://finance.sina.com.cn/roll/2018-04-23/doc-ifzqvvrz7447319.shtml,在内陆腹地省份常住人口向省会集中的过程中，省内其他城市则呈现出明显的人口迁徙流出迹象
生态环境部：将对太原11家单位向地方政府发预警函,2018-04-23 12:15,http://finance.sina.com.cn/china/gncj/2018-04-23/doc-ifzqvvrz7442921.shtml,证券时报网（www.stcn.com）04月23日讯
近1亿资金经POS机不翼而飞 钱都去哪儿了？,2018-04-23 12:13,http://www.sohu.com/a/229144385_319643,此后pos机资金到账稳定，通过交易商户代码可以看到资金结算是通过826开头的银盛支付通道，但商户名称全部跳转省外
9 要闻,2018-04-23 12:09,http://www.sohu.com/a/229144144_114731,《 人民日报 》 2018年04月23日 09 版（：人民网-人民日报）
苹果概念股纷纷走低，科技类蓝筹集体杀跌,2018-04-23 12:08,http://www.sohu.com/a/229143969_114986,金融机构mirabaud分析师neil campling在一份最新的报告中指出，鉴于目前智能手机放缓的情况，苹果今年可能会停产iphone x，调整新的应对策略
5G概念盘中拉升，创业板指跌逾1%,2018-04-23 12:08,http://www.sohu.com/a/229143785_114986,集成电路、国防军工、苹果概念等板块跌幅居前
新疆生产建设兵团棉花播种接近尾声,2018-04-23 12:08,http://www.sohu.com/a/229143990_114731,"截至目前,新疆南疆地区棉花播种已全部结束,北疆地区棉花播种已进入收尾阶段,4月下旬新疆兵团的棉花播种可全部结束"
对冲基金从没这么看多原油 但还记得2008年吗？,2018-04-23 11:59,http://www.sohu.com/a/229143010_130887,但也有市场分析给目前的“原油热”泼了一盆冷水，彭博社引述原油策略分析师julian lee的提醒称，“沙特原油部长表示全球可能会容许油价进一步走高，这一幕与2008年的情况非常相似
五得利回应面粉突遭退货：退换面粉4467袋 相关产品已主动抽样送检,2018-04-23 11:56,http://www.sohu.com/a/229142648_120702,经济日报-中国经济网北京4月23日 据媒体22日报道，媒体记者从河北省深州市食品和市场监督管理局获悉，五得利集团深州面粉有限公司生产的多批次面粉突然遭到多地经销商大量退货，原因不详
午评:沪指跌0.11% 结构性行情下芯片股分化,2018-04-23 11:56,http://www.sohu.com/a/229142281_120702,经济日报-中国经济网北京4月23日讯 股指早盘平开，随后三大股指冲高后陆续回落，有色等板块受挫拖累沪指下行，而近期热点的芯片等题材股出现显著分化，创业板指数也随之持续走低跌近1%
万丰奥威三个交易日蒸发90亿 百年人寿华鑫信托叫苦,2018-04-23 11:56,http://www.sohu.com/a/229142282_120702,陕西省国际信托股份有限公司－陕国投・鑫鑫向荣9号证券投资集合资金信托计划是在2016年第三季度进入万丰奥威前十大股东，目前持股4598万股，持股比例2.1%
新三板跨市场挂牌通H股道开启 国际化之路正式启程,2018-04-23 11:56,http://www.sohu.com/a/229142443_120702,广证恒生新三板研究团队认为，全国股转公司对挂牌公司申请到香港交易所发行股票和上市不设前置审查程序及特别条件，利好挂牌未盈利企业、生物医药类企业以及a股上市公司子公司
午间重磅公告：一公司1类注射液获注册受理,2018-04-23 11:53,http://finance.sina.com.cn/stock/y/2018-04-23/doc-ifzqvvrz7286978.shtml,农业农村部发展计划司司长魏百刚介绍，下一步农业农村部将重点围绕改善农业基础设施、强化科技支撑、推进产销衔接、整治农村人居环境等这样一些领域采取各种方式，包括ppp等等，来优化农业农村的投资环境，引导和撬动更多社会资本、金融资本来投入
三重压力之下，美国财长要访华了,2018-04-23 11:52,http://www.sohu.com/a/229142578_617374,对与中国的贸易战，特朗普原来的想法，应该也很简单：贸易战一点都不难，我们美国肯定赢
牛汇:政策会议前噤声期又至 美联储大佬近来说了啥,2018-04-23 11:52,http://finance.sina.com.cn/money/forex/forexfxyc/2018-04-23/doc-ifzqvvrz7280648.shtml,随着经济改善，美联储可能加息至中性利率水平
中国农业未来十年展望：不平衡不充分问题将得到解决,2018-04-23 11:48,http://www.sohu.com/a/229141185_118622,报告认为，2018年中国农产品市场主要特点有：农业生产保持稳健增长，结构持续优化，农产品消费继续增长，消费结构升级加快，农产品进口继续增加，架构出现分化，农产品价格总体平稳，部分品种波动风险较大
提名董事被否后 华平股份二股东再递增补董事提案,2018-04-23 11:46,http://finance.sina.com.cn/stock/s/2018-04-23/doc-ifzqvvrz7243231.shtml,提名董事被否后，华平股份（300074）二股东熊模昌（持股华平股份5309.82万股，占总股本比例9.78%）毫不气馁，于4月19日再向上市公司提交《关于公司2018年第一次临时股东大会增加临时提案的通知函》，要求增加《关于增补李强先生为公司第四届董事会非独立董事候选人的提案》
李大霄：贸易争端能否顺利解决 对股市影响重大,2018-04-23 11:45,http://finance.sina.com.cn/stock/stocktalk/2018-04-23/doc-ifzqvvrz7232065.shtml,英大证券首席经济学家李大霄表示，美国财长说准备到中国来谈判贸易争端的问题，这是一个重要的信号
挣扎的四川长虹：从“彩电大王”到忝陪末座,2018-04-23 11:45,http://finance.sina.com.cn/stock/s/2018-04-23/doc-ifzqvvrz7233023.shtml,四川长虹证券事务代表回应界面新闻称，彩电是长虹的一个传统产品，不过公司现在正在转型
沪指跌0.11% 国防军工行业跌幅最大,2018-04-23 11:45,http://finance.sina.com.cn/stock/jsy/2018-04-23/doc-ifzqvvrz7232084.shtml,数据统计，截至上午收盘，今日沪指涨幅-0.11%，a股成交量181.11亿股，成交金额2340.20亿元，比上一个交易日减6.00%
午评：沪指跌0.11% 5G概念股逆势拉升,2018-04-23 11:41,http://finance.sina.com.cn/stock/jsy/2018-04-23/doc-ifzqvvrz7206361.shtml,截至午间收盘，沪指报3068.28点，跌3.26点，跌幅0.11%，成交918.6亿元
美元多头王者归来？机构最新美元指数技术前景分析,2018-04-23 11:39,http://www.sohu.com/a/229140416_119759,godbole表示，鉴于10年期美债收益率升势才刚刚开始，美元指数势必将有效突破90.94(3月1日高点)
午评：两市走低 创业板跌逾1%,2018-04-23 11:38,http://finance.sina.com.cn/stock/jsy/2018-04-23/doc-ifzqvvrz7183492.shtml,中金公司认为，市场调整持续已经接近三个月，五月份可能是市场一个相对重要的观察窗口，届时中美贸易摩擦可能到了一定阶段、四月份中国增长数据也将披露，中国政策应对可能有更高的可见度
五一出行成本再增加 油价本周四“三连涨”几无悬念,2018-04-23 11:36,http://www.sohu.com/a/229139789_255783,4月12日24时 6.93（单位：元/升）
一季度净利润大增374.75%，中国联通强势封涨停,2018-04-23 11:36,http://www.sohu.com/a/229139695_114986,东吴证券发布研报称，中国联通通过混改和市场创新不断提升公司核心竞争力，推动收入端持续改善
中国石油管道科研中心贪污窝案 办公室副主任被判缓刑,2018-04-23 11:35,http://www.sohu.com/a/229139906_639898,被告人张某，男，1978年8月出生，博士研究生文化，中国石油管道科研中心应用化学研究所原副所长
午评：沪指横盘震荡 创业板指跌1.31%,2018-04-23 11:34,http://finance.sina.com.cn/stock/jsy/2018-04-23/doc-ifzqvvrz7156244.shtml,e公司讯，今日开盘两市涨跌不一，随后均小幅上扬，不过上攻乏力，三大股指相继下跌翻绿，创业板指跌幅不断扩大
朱啸虎称国内风投不是不投芯片，只是财务回报不理想，你怎么看？,2018-04-23 11:34,http://www.sohu.com/a/229139745_614005,据36氪报道，4月19日，金沙江创投董事总经理朱啸虎针对《中兴启示录：靠送外卖，我们永远赢不了未来的竞争》在朋友圈评论称，“中国的风险投资也不是不投芯片，只是财务回报不理想
35年国企老兵徐乐江点赞华为、中兴创新成果,2018-04-23 11:33,http://www.sohu.com/a/229139262_118622,详细来看，从混合所有制改革动力来说，徐乐江认为：“这个题不破的话，无论从国企还是民企方，要完成党中央给我们指明的方向作为基本经济制度发展混合所有制都是很困难的，这块有待实践的突破和理论的创新
午评：雄安板块高开低走 沪指震荡下跌0.11%,2018-04-23 11:33,http://www.sohu.com/a/229139652_114960,4月23日，沪指早盘低开，盘初在家电、金融等板块活跃带动下拉升翻红，随后走势震荡，午市休盘前再度回落翻绿
名博午后看市：反复筑底是主基调,2018-04-23 11:33,http://finance.sina.com.cn/stock/marketresearch/2018-04-23/doc-ifzqvvrz7151874.shtml,今日沪深两市股指开盘涨跌不一，沪指整体上在平盘线附近维持震荡走势
新三板在线晨报：“新三板+H股”落地，股转不设前置审查程序及特别条件,2018-04-23 11:31,http://www.sohu.com/a/229138780_223785,【“新三板+h股”落地 股转不设前置审查程序及特别条件】4月21日，全国中小企业股份转让系统有限责任公司(以下简称“全国股转公司”)与香港交易及结算所有限公司(以下简称“香港交易所”)在北京签署了合作谅解备忘录
午评：市场指数分化沪指跌0.11% 芯片股全线回调,2018-04-23 11:31,http://finance.sina.com.cn/stock/jsy/2018-04-23/doc-ifzqvvrz7136390.shtml,临近上午收盘，三大股指探底回升，但大小指数出现小幅分化，在银行、通信、券商等板块的积极影响下，沪指盘中曾一度翻红，创业板指数则持续低位震荡
327亿兴全合宜上市盘中跌停，短短3个月浮亏40多亿！,2018-04-23 11:29,http://finance.sina.com.cn/stock/usstock/c/2018-04-23/doc-ifzqvvrz7120257.shtml,今年1月最爆款基金产品兴全合宜一日售罄，募集了327亿巨资，今日（4月23日）兴全合宜在交易所上市首日，盘中触及跌停，投资者不仅损失的净值，而在若想现在兑现还要承受一个跌停或接近跌停的暴跌
新时代！新作为！国企改革发展论坛释放新信号,2018-04-23 11:28,http://www.sohu.com/a/229139023_115926,新华社将进一步大力宣传党中央、国务院关于国资国企改革发展的重大部署和政策举措，深入报道各类所有制企业特别是国有企业改革发展的新典型、新经验、新成就，并组织智库力量深入开展调查研究、提出对策建议，为国有企业更好更快发展营造良好舆论氛围，提供强大信息服务
商周特写 | 最大丑闻缠身，大众汽车忙赎罪,2018-04-23 11:27,http://www.sohu.com/a/229141371_320672,考虑到大众汽车所犯错误的巨大程度，消费者竟然愿意原谅它，这确实是一件不同寻常的事情：麻省理工学院(mi t)的科学家估计，被该公司操纵的汽车所排放出的额外污染将最终导致超过1200人过早死亡
邦达亚洲:加息降温且脱欧忧虑重燃 英镑刷新2周低位,2018-04-23 11:27,http://finance.sina.com.cn/money/forex/forexfxyc/2018-04-23/doc-ifzqvvrz7108189.shtml,除美元指数在美债收益率走高和市场避险情绪升温的联合支撑下突破90.00关口是施压欧元走软的主要原因外，时段内欧洲央行行长德拉基承认欧元区区经济放缓的言论也对欧元构成了一定的打压
读数观市 | 通胀预期上升，3%再成美国国债收益率关注焦点,2018-04-23 11:27,http://www.sohu.com/a/229141461_320672,伴随发行量暴增引发的英国国债和德国国债的跌势，基准10年期美国国债收益率此前触及2.93%，相距2月创下的2018年年内高点不到2个基点
思・辨 | 贸易战一旦开火，美国大公司最受伤,2018-04-23 11:27,http://www.sohu.com/a/229141087_320672,美国公司在中国的日子那是相当滋润，远不是美国贸易逆差数据所反映得那么糟
河北幼儿园食品安全新动态：快看,2018-04-23 11:26,http://www.sohu.com/a/229140023_160687,在“证照分离”改革试点期间，河北省人民政府《关于开展“证照分离”改革试点工作方案的通知》(冀政字z2018{6号)中涉及的12个小餐饮登记证核发改为备案的“证照分离”改革试点地区，未取得主体资格证明文件并正常经营的个体幼儿园，办理小餐饮备案卡，主体业态为小餐饮（幼儿园）
美国纳税季结束，比特币较月初反弹40%,2018-04-23 11:25,http://www.sohu.com/a/229138513_130887,lee上周表示，随着美国个税申报季结束，数字货币价格又将重新走高
IMF副总裁支持日本观点 认为TPP优于双边协议,2018-04-23 11:25,http://www.sohu.com/a/229138236_538698,国际货币基金（imf）副总裁古泽满宏支持日本呼吁美国重新加入跨太平洋伙伴关系协定（tpp）的看法，称tpp这类多边协定在解决贸易失衡上优于双边协议
收益率曲线趋平暗示经济衰退征兆？联储：不必担心,2018-04-23 11:24,http://www.sohu.com/a/229137998_538698,明尼亚波利斯联储主席卡什卡利上周五在接受cnbc采访时表示，收益率曲线趋平就是“黄灯在闪烁”，是美联储应该停止升息的警讯，以免刹车踩得过快，使经济有落入衰退之虞
国产第一艘航母在拖轮的协助下 离开泊位,2018-04-23 11:24,http://finance.sina.com.cn/china/gncj/2018-04-23/doc-ifzqvvrz7085879.shtml,（新浪财经注：此前环球时报报道称，多家媒体猜测，国产航母可能将于4月23日海军节这天进行首次海试
今年实现5.5%失业率目标是否有压力？就业市场最大问题是什么？,2018-04-23 11:24,http://www.sohu.com/a/229138227_614005,除此之外，随着中国老龄化的不断加剧，更多的70后和80后占据的市场可能会挤占不少后辈的位置，因而年龄结构的变化也相应的带来实业方面的压力，最后性别方面，由于女性社会地位，受教育程度的提高，也让更多的人走入社会，参与到岗位竞争
肖亚庆：必须突出主业开展央企并购重组,2018-04-23 11:23,http://www.sohu.com/a/229137972_118622,所以，在长期发展的过程中必须明确在国际化经营中主业的发展目标和重点，坚定不移聚焦主业、突出主业开展并购重组和专业化整合，推动技术、人才、资本等各类资源要素向主业集中，不断增强核心业务的资源配置效率、盈利能力和市场竞争力
金山惠民村镇银行屡次迟报错报统计报表 被罚款25万,2018-04-23 11:21,http://www.sohu.com/a/229137811_639898,根据处罚信息显示，2016年至2017年，上海金山惠民村镇银行报送非现场监管统计报表屡次发生迟报、错报，严重影响了辖内银行业统计数据的准确性和及时性
纪念流通改革开放40周年系列活动启动,2018-04-23 11:20,http://www.sohu.com/a/229137538_114731,"启动仪式上,中国商业经济学会新任会长马龙龙教授表示,中国商业经济学会和中国流通三十人论坛(g30)在未来两年将以“流通改变中国”为主题,围绕消费结构升级与流通供给侧改革、科技创新与新零售动力、共享经济与新商业生态、自贸区(港)建设与现代服务业示范、跨界融合与新产业联盟等五个单元,联合社会优势资源,组织一系列研究、交流、合作和示范推进活动"
交易商：欧元/美元4月23日交易策略,2018-04-23 11:19,http://www.sohu.com/a/229137440_119759,上行方面，欧元只有重返1.2324/29上方才暗示跌势已经形成低点，可能存在进一步走强至1.2353/59的风险，不过1.2395/00应该会抑制涨势
闵行上银办理部分无真实背景票据业务 被罚款30万,2018-04-23 11:19,http://www.sohu.com/a/229137075_639898,根据处罚信息显示，2016年至2017年，上海闵行上银村镇银行为严格审查票据贸易背景真实性，办理了部分无真实贸易背景的票据业务，上海银监局依据《中华人民共和国银行业监督管理办法》第四十六条第（五）项，责令闵行上银村镇银行改正，并处罚款30万元
华夏幸福答上交所“18问” 其董秘称无须过度解读,2018-04-23 11:19,http://www.sohu.com/a/229137407_118622,6、问：请公司补充披露结合公司房地产开发业务的区域分布、行业可比公司情况，说明房地产开发业务收入下降的原因
昔日徐翔资产要收编？接盘侠竟是同城兄弟，旗下掌控一家A股公司,2018-04-23 11:18,http://www.sohu.com/a/229139604_100023965,公告显示，宁波中百近日收到宁波鹏渤投资有限公司拟向公司全体股东发起部分要约的函，该函中明确要约形式为部分要约，本次要约收购不以终止公司的上市地位为目的
一季度第一产业投资增速达24.2% 大幅高于二三产业,2018-04-23 11:17,http://www.sohu.com/a/229136783_123753,魏百刚表示，今年以来，第一产业固定资产投资确实是快速增长，增速大幅高于二三产业的增速，这是一个好现象，农业农村发展当中缺钱、缺人才，所以投资增加对农业农村发展是非常有利的，我们分析，有这么几个方面的原因：
同有科技董事长做庄自家股票？ 公司回应：在积极核实 |新京报财讯,2018-04-23 11:15,http://www.sohu.com/a/229136480_114988,同有科技表示，周泽湘先生自公司上市以来，未曾减持过公司股票
平安好医生5月4日挂牌，市值或将达542亿港元~585亿港元,2018-04-23 11:13,http://www.sohu.com/a/229136094_118792,除了平安好医生之外，丁香园、微医等互联网医疗平台都在蓄势待发，目前，互联网医疗上市潮已经开启，2018年或将成为互联网医疗平台集中上市的元年
电子社保卡上线，不只是把证件信息搬上“网”| 新京报快评,2018-04-23 11:11,http://www.sohu.com/a/229138455_616821,这可有效降低民众的领取和接入成本，像第三方支付已经普及，多数人无需再另外下载服务应用即可获取电子证件
北京住建委回应“万科高价自持租赁房”：只许租不许售 不能获得产权,2018-04-23 11:11,http://www.sohu.com/a/229135976_222256,针对北京万科翡翠书院“月租金最低1.5万、10年租金180万元起”的报道引发的关注和议论，北京市住建委相关负责人近日表示，竞自持租赁住房，企业只许租不许售
网店店主、模特、主播：新形态的就业也该被一视同仁 | 新京报专栏,2018-04-23 11:11,http://www.sohu.com/a/229138560_616821,以新零售为代表的互联网科技创造的新就业形态，拓宽了社会就业面，对接了缓解结构性失业之需
同有科技董事长做庄自家股票？ 公司回应:在积极核实,2018-04-23 11:10,http://finance.sina.com.cn/stock/s/2018-04-23/doc-ifzqvvrz6978341.shtml,2017年12月，同有科技公告称，基于对公司未来发展前景的信心以及对公司价值的认可，周泽湘先生12月21日、12月28日、12月29日通过深圳证券交易所证券交易系统增持了公司部分股份
曾志敏：中兴制裁案与中美贸易战的实质,2018-04-23 11:10,http://www.sohu.com/a/229142096_550967,从近期动作来看，美国正动用一系列的组合拳，大力巩固它位于全球科技创新经济制高点的地位，全面延缓中国在关键科技创新领域发展的步伐
众怒难息！大韩航空高管将立即辞职,2018-04-23 11:08,http://www.sohu.com/a/229135951_561670,据了解，赵亮镐还有一名儿子赵源泰，也是“劣迹斑斑”，曾因违反交规撞倒70多岁老太太而受到指责，还因经营纠纷对抗议民众飙粗口，兄妹三人比着“坑爹”，将大韩航空推向舆论的风口浪尖
加息周期中的美元贬值,2018-04-23 11:06,http://www.sohu.com/a/229139829_523315,三是展望未来，如果全球不发生大的经济金融或地缘政治等风险事件，联储加息周期仍将伴随着美元走弱趋势，这客观上有助于人民币汇率的稳中趋升
努钦:IMF需处理外部失衡、贸易壁垒和知识产权问题,2018-04-23 11:05,http://finance.sina.com.cn/stock/usstock/c/2018-04-23/doc-ifzqvvrz6937457.shtml,“imf必须着手开始处理这个问题，发出强有力的声音，并在成员国维持促进不公平竞争优势或导致失衡增长的宏观经济、外汇及贸易政策的情况下，持之以恒地指出问题所在
2018年4月23日FX168汇市早自习,2018-04-23 11:05,http://www.sohu.com/a/229135513_119759,欧洲股市周五（4月20日）收盘相对持平，投资者消化了一批新的企业收益，同时密切关注海外市场动向
一张图告诉你 对冲基金眼下究竟有多看涨欧元,2018-04-23 11:04,http://www.sohu.com/a/229135447_119759,fx168财经报社(香港)讯 彭博周一(4月23日)撰文称，最新的美国商品期货交易委员会(cftc)数据显示，投机人士并未理会欧元区经济数据的恶化，欧元看涨头寸创下纪录高位
IBM大中华区董事长陈黎明：中兴被制裁是个案，企业国际化需合规,2018-04-23 11:03,http://www.sohu.com/a/229134902_100001551,4月23日，在2018年中国绿公司年会上，元丰资本创始人吴军和ibm大中华区董事长陈黎明在智能商业时代的讨论中就中兴被美国商务部制裁一事表达了自己了观点
日本电通每月给员工增加一天假期 从6月开始试行,2018-04-23 11:01,http://www.sohu.com/a/229134834_114731,"人民网东京4月23日电 据《朝日新闻》网站报道,日本电通16日宣布称,将从6月开始面向所有员工试行“每月增加一天休息日”的新制度"
债市继续回调 货币政策是否迎来拐点关键看本周,2018-04-23 11:01,http://www.sohu.com/a/229134657_130887,华创宏观团队也提到，流动性宽松利好债市，但宏观稳杠杆的政策背景下， 央行主动引导流动性宽松和政策面再次刺激都难以兑现，降准也不应理解为政策转向，结合当前的基本面，二季度商品表现会明显强于一季度，债市则将承受来自基本面的调整压力
A股69芯片概念股总市值不抵美三巨头 靠政府补助盈利,2018-04-23 11:00,http://finance.sina.com.cn/stock/marketresearch/2018-04-23/doc-ifzqvvrz6896256.shtml,据中泰证券研报梳理，国内存储芯片设计龙头是兆易创新、国产gpu龙头是景嘉微、半导体分立器件龙头是扬杰科技、led芯片龙头是三安光电、国内idm优质企业是士兰微、国产半导体设备龙头是北方华创、目前国内领先的集成电路芯片设计和系统集成解决方案供应商是紫光国芯、国内高性能计算的龙头企业是中科曙光、嵌入式处理器芯片领先企业是北京君正、国内优质的ic设计公司是中颖电子、全球生物识别芯片领先企业是汇顶科技、国产半导体封测龙头是长电科技
乐视网再度大跌，为何每次价格腾飞都被压下去？,2018-04-23 11:00,http://www.sohu.com/a/229134547_102150,其中，第一次价格腾飞，是今年3月12日至14日，乐视网股价短期出现超过20%的涨幅，但3月14日收盘后股价遭到停牌核查的压力，且面临融创中国孙宏斌的辞职因素影响，3月16日乐视网却出现了一字板跌停的走势，并在两个交易日时间内跌回3月12日起步点，而后步入阴跌过程，到了今年4月16日，乐视网股价再度回到4.08元的位置，一轮调整之后，股价累计最大跌幅达到40%
把时间集中在估值上，而不是预测上,2018-04-23 10:59,http://www.sohu.com/a/229134467_313170,这也是价值投资在过去100年中发挥作用的原因
证监会拟允许内地机构使用香港证券投资咨询服务,2018-04-23 10:59,http://finance.sina.com.cn/stock/hkstock/2018-04-23/doc-ifzqvvrz6884735.shtml,允许内地证券公司或者其从事发布证券研究报告业务的子公司，将香港机构发布的就港股通股票提供投资分析意见的证券研究报告转发给客户
把时间集中在估值上，而不是预测上,2018-04-23 10:59,http://www.sohu.com/a/229134709_313170,这也是价值投资在过去100年中发挥作用的原因
五年后世界电动飞机市场规模将超1.2亿美元,2018-04-23 10:56,http://www.sohu.com/a/229133868_115926,报告预测，世界电动飞机市场规模将从2018年的9930万美元（估计值）增长至2023年的1.218亿美元，2018年至2023年的年复合增长率为4.17%
雄安新区概念走弱 万方发展跌停,2018-04-23 10:55,http://finance.sina.com.cn/stock/jsy/2018-04-23/doc-ifzqvvrz6851421.shtml,雄安新区板块走弱，此前涨幅一度达到1%，目前雄安新区指数下跌0.32%，个股方面，万方发展跌停，建科院跌8.77%，京汉股份跌逾7%，渤海股份、 创业环保、沧州明珠跌逾6%
百姓网：精装房成租房首选 家具租赁或将走俏,2018-04-23 10:55,http://www.sohu.com/a/229133598_115239,据了解，现在市场上已经有租赁企业包括一部分大家具品牌也在尝试二手家具的回收租赁，开启共享家具模式，由家具厂商提供成品家具，租赁商为租房白领及房主提供租赁维修服务，实现家具回收共享
